{"api_version":"llm.temporal/compact/v1","operation_key":"compact-1","operation_id":"op-compact-1","status":"completed","checkpoint":{"handle":"ckp_v1.compact","kind":"compaction","depth":2,"parent":"ckp_v1.child"},"cache":{"disposition":"disabled","variant":0},"cost":{"status":"exact","actual_cost_usd":"0","method":"provider_reported"},"provenance":{"source":"provider"},"diagnostics":[]}